{
  "schema_version": "MOMENTO_NBA_CAPTURE_PROGRAM_V1",
  "episode_id": "template-unarmed-unavailable",
  "first80_trade_id": null,
  "event_id": null,
  "ticker": null,
  "game_date": null,
  "created_utc": "1970-01-01T00:00:00+00:00",
  "engine_a_intent": "UNAVAILABLE",
  "same_bar_limitation": "SAME_BAR_1M_LIMITATION",
  "live_armed": false,
  "notes": "Template only. Paper/unarmed episodes may keep L2 and fills UNAVAILABLE.",
  "events": [
    {
      "event_type": "MARKET_BEFORE_ENTRY",
      "event_index": 0,
      "timestamp_utc": null,
      "timestamp_unix": null,
      "status": "UNAVAILABLE",
      "client_order_id": null,
      "exchange_order_id": null,
      "side": null,
      "price_cents": null,
      "quantity": null,
      "remaining_quantity": null,
      "post_only": null,
      "reduce_only": null,
      "yes_bid_cents": null,
      "yes_ask_cents": null,
      "last_trade_cents": null,
      "fee": null,
      "cash": null,
      "path_label_R": null,
      "detail": "No book snapshot in this milestone"
    },
    {
      "event_type": "NO_FILL",
      "event_index": 1,
      "timestamp_utc": null,
      "timestamp_unix": null,
      "status": "UNAVAILABLE",
      "client_order_id": null,
      "exchange_order_id": null,
      "side": null,
      "price_cents": null,
      "quantity": null,
      "remaining_quantity": null,
      "post_only": true,
      "reduce_only": false,
      "yes_bid_cents": null,
      "yes_ask_cents": null,
      "last_trade_cents": null,
      "fee": null,
      "cash": null,
      "path_label_R": null,
      "detail": "Unarmed: no order submitted"
    },
    {
      "event_type": "NET_REALIZED_PNL",
      "event_index": 2,
      "timestamp_utc": null,
      "timestamp_unix": null,
      "status": "UNAVAILABLE",
      "client_order_id": null,
      "exchange_order_id": null,
      "side": null,
      "price_cents": null,
      "quantity": null,
      "remaining_quantity": null,
      "post_only": null,
      "reduce_only": null,
      "yes_bid_cents": null,
      "yes_ask_cents": null,
      "last_trade_cents": null,
      "fee": {
        "amount": null,
        "unit": "USD",
        "status": "UNAVAILABLE",
        "label": null
      },
      "cash": {
        "amount": null,
        "unit": "USD",
        "status": "UNAVAILABLE",
        "label": "EV_realized"
      },
      "path_label_R": {
        "amount": null,
        "unit": "R_UNITS",
        "status": "UNAVAILABLE",
        "label": "not EV_realized"
      },
      "detail": "EV_realized unavailable until observed fills and fees exist"
    }
  ]
}
